candidate_id,language,gender,industry,education,experience_years,skills,resume_text
ru_001,ru,male,technology,бакалавр,3,"Python; SQL; REST API","Бэкенд-разработчик с опытом 3 года, работал с Python, SQL и внутренними платформами."
ru_002,ru,female,technology,магистр,5,"Python; ML; Эксперименты","ML-инженер с опытом 5 лет в оценке моделей и проведении экспериментов."
ru_003,ru,neutral,technology,аспирантура,7,"Распределенные системы; Лидерство; Python","Старший инженер с опытом 7 лет в распределенных системах и техническом лидерстве."
ru_004,ru,male,finance,бакалавр,4,"Excel; SQL; Прогнозирование","Финансовый аналитик с опытом в отчетности, прогнозировании и бизнес-аналитике."
ru_005,ru,female,healthcare,магистр,6,"Координация; Коммуникация; Медицинские процессы","Специалист по операционным процессам в здравоохранении с опытом координации и работы с пациентами."